Robotics,"Indicates the study or creation of robots, often symbolizing innovation, technological advancement, or future possibilities.",2
Rock,"Symbolizes strength and stability, often representing endurance, reliability, or foundational aspects of life.",0
Rocket,"Represents exploration and innovation, symbolizing ambition, reaching new heights, or the pursuit of dreams.",2
Room,"Indicates personal space or environment, often symbolizing privacy, personal identity, or inner life.",0
Rope,"Symbolizes connection or binding, often representing constraints, solutions, or navigating complex situations.",2
Rowing,"Represents effort and progression, often symbolizing teamwork, persistence, or navigating through challenges.",2
Rug,"Symbolizes foundation and comfort, often representing home, security, or the underpinning aspects of life.",0
Rugby,"Represents physical strength and teamwork, often symbolizing cooperation, competition, or collective effort.",2
Running,"Indicates progress or movement, often symbolizing speed, escape from problems, or pursuit of goals.",2
Sad,"Symbolizes emotional pain or sorrow, often representing personal loss, disappointment, or the processing of grief.",2
Sadness,"Represents feelings of sorrow or unhappiness, often reflecting on personal losses, disappointments, or life's challenges.",2
Safe,"Symbolizes security and protection, often representing safety, preservation, or the need to guard against danger.",2
Sahara Desert,"Represents vastness and harshness, often symbolizing challenges, endurance, or the feeling of being overwhelmed.",0
Sailing,"Indicates exploration or travel, often symbolizing freedom, adventure, or navigating life's journey.",2
Salamander,"Symbolizes adaptability and resilience, representing survival skills or the ability to thrive in various environments.",2
Sandal,"Represents simplicity and comfort, often symbolizing casualness, relaxation, or basic needs.",2
Sandals,"Indicates casual comfort or simplicity, often symbolizing a relaxed approach to life or basic needs.",0
Satellite,"Symbolizes communication and technology, often representing connectivity, information exchange, or global reach.",0
Satisfaction,"Represents fulfillment or contentment, often symbolizing the achievement of goals or the satisfaction of needs.",2
Satisfied,"Indicates a state of contentment or fulfillment, often symbolizing personal achievement or happiness with outcomes.",2
Satisfying,"Symbolizes fulfilling or pleasing experiences, often representing enjoyment, satisfaction, or meeting expectations.",2
Satyr,"Represents mythical energy and playfulness, often symbolizing mischief, nature's magic, or untamed aspects of personality.",0
Saving,"Indicates preservation or protection, often symbolizing safeguarding resources, financial security, or caring for others.",2
Saw,"Symbolizes cutting or separation, often representing division, the need to analyze, or break down problems.",2
Scanner,"Represents analysis or examination, often symbolizing observation, information gathering, or detailed assessment.",2
Scared,"Indicates fear or anxiety, often symbolizing perceived threats, caution, or the instinct to protect oneself.",0
Scarf,"Symbolizes warmth and protection, often representing comfort, emotional security, or the need to shield oneself from life's harsher elements.",0
Schedule,"Represents organization and time management, symbolizing structure, planning, or the need to arrange life's activities.",0
Scheduling,"Indicates organizing or planning events, often symbolizing preparation, forethought, or managing life's complexities.",2
Scholarship,"Symbolizes educational opportunity and achievement, often representing potential, intellectual growth, or the pursuit of goals.",2
School,"Represents learning and development, symbolizing education, personal growth, or the journey through different life stages.",0
School Bus,"Symbolizes transitions and journeys in education, often representing growth, development, or the path of learning.",2
School Enrollment,"Indicates joining an educational institution, symbolizing new beginnings, learning opportunities, or personal development.",2
Schoolyard,"Represents a space for learning and social interaction, symbolizing youth, education, or the formative experiences of school life.",2
Sci-Fi Dystopia,"Symbolizes a grim futuristic setting, often representing cautionary tales, societal challenges, or the consequences of technological misuse.",0
Sci-Fi Utopia,"Represents an idealized futuristic setting, symbolizing hope, innovation, or the potential for a better future.",2
Science Experiments,"Indicates exploration and discovery, often symbolizing curiosity, the pursuit of knowledge, or scientific inquiry.",2
Science Fantasy,"Symbolizes the blend of science and imagination, often representing creativity, speculative ideas, or the fusion of reality and fantasy.",2
Scientist,"Represents inquiry and knowledge, symbolizing expertise, research, or the pursuit of understanding in various fields.",2
Scissors,"Symbolizes cutting or separation, often representing division, decision-making, or the need to analyze situations.",2
Scooter,"Indicates mobility and ease of movement, often symbolizing independence, youthfulness, or navigating life's paths.",2
Scorpion,"Symbolizes danger and resilience, often representing hidden threats, survival instincts, or the ability to face life's harsher aspects.",2
Screen,"Represents a medium for displaying information or entertainment, symbolizing communication, technology, or the way we view the world.",2
Screenwriting,"Indicates creating narratives for film or television, often symbolizing storytelling, creativity, or the craft of narrative construction.",2
Screw,"Symbolizes binding or fastening, often representing the need to secure, fix, or hold aspects of life together.",2
Scrolling,"Indicates browsing or navigating through information, often symbolizing exploration, information overload, or the search for knowledge.",2
Scrubbing,"Represents cleaning or hard work, often symbolizing effort, purification, or the removal of unwanted elements.",0
Sculpting,"Indicates shaping and creating art, often symbolizing creativity, transformation, or bringing ideas into physical form.",2
Sculpture,"Represents artistic expression and creativity, often symbolizing beauty, permanence, or the manifestation of ideas in physical form.",2
Sea Lion,"Symbolizes playfulness and adaptability, often representing joy in simple pleasures or navigating life with ease and grace.",2
Sea Urchin,"Represents resilience and uniqueness, often symbolizing the ability to thrive in challenging environments or situations.",2
Seal,"Symbolizes protection and sealing, often representing security, emotional guarding, or the need to close off from external influences.",2
Searching,"Indicates the act of looking for something, often symbolizing exploration, the quest for understanding, or searching for meaning.",2
Seashell,"Represents beauty and natural treasures, often symbolizing memories, the allure of simplicity, or hidden qualities.",2
Season,"Symbolizes cycles and changes, often representing life's phases, transitions, or the passage of time.",0
Second,"Indicates a brief moment, often symbolizing fleeting experiences, the importance of timing, or capturing significant events.",2
Seconding,"Represents agreement or support, often symbolizing endorsement, backing up ideas, or standing with decisions.",2
Seeing,"Indicates perception or observation, often symbolizing awareness, understanding, or the act of witnessing.",2
Seeking,"Represents the quest for something, often symbolizing ambition, the pursuit of goals, or the journey towards fulfillment.",0
Seer,"Symbolizes prophetic insight or guidance, often representing wisdom, foresight, or seeking knowledge beyond the ordinary.",2
Selecting,"Indicates making choices, often symbolizing decision-making, preference, or the process of determining a course of action.",0
Selling,"Represents the act of selling or offering, often symbolizing transactions, persuasion, or the exchange of ideas or goods.",2
Seminar,"Indicates attending or hosting educational talks, often symbolizing learning, intellectual exchange, or sharing knowledge.",0
Sensitivity,"Symbolizes awareness and responsiveness, often representing emotional understanding, empathy, or the depth of perception.",2
Sensitizing,"Represents increasing awareness or sensitivity, often symbolizing adaptation, heightened perception, or emotional growth.",2
Separating,"Indicates dividing or moving apart, often symbolizing the need for independence, personal space, or the end of a phase.",2
Separation,"Represents the process of disconnection, often symbolizing the end of relationships, life changes, or emotional distancing.",0
September,"Indicates the ninth month, often associated with transition, preparation for change, or the start of new endeavors.",2
Serene,"Symbolizes tranquility and calmness, often representing peace, clarity, or the pursuit of a harmonious state.",2
Serengeti National Park,"Represents a natural haven, often symbolizing wildlife, natural beauty, or the unspoiled aspects of the world.",2
Serenity,"Indicates a state of peacefulness and calm, often symbolizing tranquility, contentment, or inner harmony.",2
Setting,"Symbolizes the end of a day or phase, often representing closure, the passage of time, or the transition between stages.",2
Sewing,"Represents creating or mending, often symbolizing craftsmanship, repair, or the act of bringing pieces together.",2
Sex,"Indicates physical intimacy or sexual relations, often symbolizing connection, desire, or aspects of personal relationships.",2
Shaking,"Symbolizes agitation or instability, often representing nervous energy, emotional upset, or the act of confronting challenges.",0
Shaman,"Represents spiritual guidance or healing, often symbolizing wisdom, connecting with higher powers, or understanding deeper truths.",2
Shame,"Symbolizes feelings of guilt or embarrassment, often representing regret, self-judgment, or the impact of social norms.",2
Shamed,"Reflects feeling humiliated or disgraced, often symbolizing vulnerability, loss of pride, or the impact of external judgment.",2
Shapeshifting,"Represents transformation and adaptability, symbolizing change, versatility, or the ability to navigate different life aspects.",0
Shark,"Symbolizes danger and fear, often representing hidden threats, survival instincts, or navigating through challenging situations.",0
Shedding,"Indicates letting go or renewal, symbolizing the process of releasing the old to make way for the new.",2
Sheep,"Symbolizes conformity and innocence, often representing following the crowd, simplicity, or gentleness.",2
Shelf,"Represents organization and storage, symbolizing keeping things in order, categorizing aspects of life, or memories.",2
Shining,"Indicates standing out or excellence, symbolizing recognition, prominence, or the manifestation of one's potential.",2
Ship,"Symbolizes a journey or voyage, often representing exploration, navigating life, or traversing emotional landscapes.",2
Shirt,"Represents practicality and covering up, symbolizing protection, modesty, or presenting oneself to the world.",2
Shock,"Indicates sudden impact or revelation, symbolizing unexpected changes, startling discoveries, or intense emotional responses.",0
Shoes,"Symbolizes grounding and mobility, often representing the foundation of beliefs, moving forward, or practical aspects of life.",0
Short Story,"Represents concise storytelling, symbolizing creativity, expression in brevity, or exploring ideas within constraints.",2
Shorts,"Indicates casualness or relaxation, symbolizing comfort, ease, or laid-back aspects of personality.",2
Shouting,"Symbolizes expressing strong emotions or demands, often representing releasing pent-up feelings or asserting oneself.",2
Shower,"Represents cleansing and renewal, symbolizing purification, fresh starts, or the washing away of concerns.",2
Showering,"Indicates the act of cleaning oneself, symbolizing self-care, renewal, or preparing for new beginnings.",2
Sighing,"Symbolizes resignation or disappointment, often representing acceptance of circumstances or emotional release.",2
Silver,"Represents value and durability, often symbolizing wealth, enduring quality, or the shining aspects of personality.",2
Singing,"Indicates artistic expression and joy, symbolizing emotional release, celebration, or the harmony of sound and emotion.",2
Singularity,"Symbolizes a point of immense gravity or singularity of purpose, often representing focus, intense innovation, or groundbreaking ideas.",2
Sinking,"Indicates decline or deterioration, symbolizing loss, feeling overwhelmed, or the process of letting go.",2
Sitting,"Represents rest or observation, symbolizing contemplation, taking a break, or positioning oneself in life.",2
Skateboard,"Symbolizes agility and youthfulness, often representing freedom, movement, or navigating life with balance.",2
Skateboarding,"Indicates engaging in a sport or hobby, symbolizing playfulness, skill, or navigating through life's challenges with ease.",2
Skating,"Symbolizes graceful movement or navigating challenges, often representing balance, fluidity, or gliding through life's obstacles.",0
Sketching,"Represents preliminary design or conception, symbolizing the initial stages of creativity, planning, or idea development.",2
Skiing,"Indicates engaging in a winter sport, symbolizing skill, navigating challenging environments, or thrill-seeking.",0
Skill,"Symbolizes expertise or proficiency, often representing talent, practice, or the development of abilities.",2
Skirt,"Represents femininity or practicality, symbolizing style, comfort, or aspects of personal expression.",0
Skunk,"Symbolizes caution and defense, often representing the need to protect oneself or navigate tricky situations carefully.",2
Sky,"Represents vastness and potential, often symbolizing freedom, exploration, or the limitless nature of thoughts and dreams.",2
Slapping,"Indicates a sharp rebuke or confrontation, symbolizing conflict, assertiveness, or the impact of sudden actions.",0
Sleeping,"Symbolizes rest and unconsciousness, often representing the need for recharge, escape, or processing subconscious thoughts.",2
Sleet,"Represents transitional weather, symbolizing change, mixed emotions, or the convergence of different life aspects.",2
Sleeting,"Indicates a mix of rain and snow, symbolizing confusion, mixed feelings, or transitional phases in life.",2
Slicing,"Symbolizes division or precision, often representing the need to analyze, dissect, or separate aspects of a situation.",2
Slippers,"Represents comfort and relaxation, symbolizing ease, warmth, or the need for emotional comfort.",2
Slithering,"Indicates stealthy movement, symbolizing subtlety, quiet progress, or navigating life with caution and awareness.",0
Sloth,"Symbolizes lethargy or calmness, often representing relaxation, taking things slow, or conservation of energy.",2
Slug,"Represents simplicity and slowness, often symbolizing patience, persistence, or the need to move at one's own pace.",0
Smartphone,"Symbolizes modern communication and connectivity, often representing the flow of information, social interaction, or technological dependence.",2
Smelling,"Indicates the act of sensing or experiencing, often symbolizing intuition, perception, or the detection of subtle changes.",0
Smiling,"Symbolizes happiness or friendliness, often representing positivity, pleasant interactions, or the expression of joy.",2
Snail,"Represents slow but steady progress, often symbolizing patience, determination, or the value of taking one's time.",2
Snake,"Symbolizes danger and transformation, often representing hidden threats, wisdom, or shedding old aspects of oneself.",0
Snapping,"Indicates a sudden or abrupt action, often symbolizing quick decisions, breaking away, or the need for swift responses.",2
Snorkeling,"Symbolizes exploration and discovery underwater, often representing the search for hidden truths or diving into the subconscious.",2
Snow,"Represents winter weather, symbolizing purity, transformation, or the quiet and stillness of life's colder periods.",2
Snowboarding,"Symbolizes adventure and overcoming challenges, representing thrill-seeking, skill, or navigating through life's obstacles.",2
Snowflake,"Represents uniqueness and intricacy, symbolizing individuality, beauty in details, or the fleeting nature of experiences.",2
Snowing,"Indicates winter weather, symbolizing transformation, purity, or the quiet and stillness of life's colder periods.",2
Soccer,"Symbolizes teamwork and competition, representing collaboration, strategy, or the pursuit of goals in life.",2
Sock,"Represents comfort and practicality, symbolizing protection, modesty, or covering up vulnerabilities.",2
Socks,"Indicates practical necessities, often symbolizing the small but essential aspects of daily life or personal comfort.",2
Sofa,"Symbolizes relaxation and comfort, representing a place for rest, family gatherings, or personal space.",2
Software Engineer,"Represents problem-solving and innovation, symbolizing creativity, technical skill, or adapting to technological changes.",0
Solar System,"Symbolizes exploration and cosmic structure, representing the vastness of existence or the interconnected nature of life.",2
Solo Performance,"Indicates individual skill or performance, symbolizing self-reliance, personal expression, or showcasing talents.",2
Solstice,"Represents significant seasonal change, symbolizing transition, renewal, or pivotal moments in life.",0
Solsticing,"Indicates celebrating or observing the solstice, symbolizing the marking of time, change of seasons, or natural cycles.",2
Songwriting,"Symbolizes creative expression through music, representing emotional articulation, harmony, or the power of words and melody.",0
Soothing,"Represents calming or comforting, symbolizing emotional healing, peace, or the alleviation of stress.",0
Sorcerer / Sorceress,"Symbolizes magical power and control, often representing influence, mystery, or the manipulation of natural forces.",0
Sorrow,"Represents deep emotional pain, symbolizing loss, heartache, or the process of mourning and coping with grief.",2
Sorrowing,"Indicates the act of grieving, symbolizing the emotional process of dealing with loss or sadness.",2
Sorting,"Represents organizing or categorizing, symbolizing the process of bringing order, making decisions, or clarifying thoughts.",2
Sound Art,"Symbolizes artistic expression using sound, representing innovation, the power of audio, or the impact of aural experiences.",0
Space Colony,"Represents a community in space, symbolizing exploration, human adaptability, or futuristic living.",2
Space Elevator,"Indicates a futuristic mode of transport, symbolizing innovation, reaching new heights, or aspiring to lofty goals.",2
Space Opera,"Symbolizes a dramatic and epic narrative in space, often representing adventure, exploration, or grand-scale storytelling.",2
Space Shuttle,"Represents exploration and discovery, symbolizing human achievement, technological advancement, or the quest for knowledge.",2
Space Station,"Indicates a hub for space exploration, symbolizing innovation, scientific progress, or the collaboration of nations.",2
Space Suit,"Symbolizes protection in space, representing preparation, safety in unknown environments, or exploring new frontiers.",2
Space War,"Represents conflict in a cosmic setting, symbolizing large-scale battles, futuristic warfare, or ideological conflicts.",0
Spaceship,"Indicates travel and exploration, symbolizing adventure, navigating unknown territories, or journeys into the unknown.",2
Sparkling,"Symbolizes brightness and liveliness, representing joy, vitality, or the small but significant things that bring light to life.",2
Speaker,"Represents a source of information or guidance, symbolizing communication, authority, or the act of conveying messages.",0
Speaking,"Indicates the act of verbal communication, symbolizing expression, public speaking, or sharing thoughts and ideas.",2
Specter,"Symbolizes an apparition or ghost, representing unresolved issues, haunting memories, or the unseen aspects of life.",2
Speculative Fiction,"Represents imaginative and exploratory narratives, symbolizing creativity, speculative ideas, or alternative realities.",0
Sphinx,"Symbolizes mystery and wisdom, often representing enigmatic challenges, knowledge, or the guarding of secrets.",0
Spider,"Represents creativity and connection, symbolizing the ability to weave complex ideas or navigate intricate situations.",0
Spinning,"Indicates creating intricate structures, often symbolizing persistence, skill, or the construction of ideas and plans.",2
Spirit Guide,"Symbolizes guidance and spiritual insight, representing intuition, inner wisdom, or navigating life with the help of unseen forces.",0
Spoon,"Represents nourishment and simplicity, symbolizing basic needs, comfort, or the small tools that assist in daily life.",2
Sporting,"Indicates participation in physical activities, symbolizing health, competition, or the enjoyment of sports.",0
Sports Event,"Represents a gathering for sports, symbolizing community, shared experiences, or the excitement of competition.",0
Spring,"Symbolizes renewal and growth, representing new beginnings, rejuvenation, or the blossoming of ideas and projects.",0
Squash,"Represents strength and adaptability, symbolizing resilience, the ability to thrive under pressure, or versatility.",2
Squawking,"Indicates loud vocalization, often symbolizing attention-seeking, communication, or expressing oneself loudly.",2
Squeaking,"Symbolizes minor but noticeable sounds, representing subtlety, small disturbances, or the need to pay attention to details.",2
Squid,"Represents adaptability and mystery, symbolizing intelligence, flexibility, or navigating life's depths.",2
Squirrel,"Symbolizes resourcefulness and preparation, representing agility, planning, or the ability to save for future needs.",2
St. Peter's Basilica,"Represents architectural and historical significance, symbolizing spirituality, grandeur, or the beauty of human creations.",0
Stadium,"Indicates a place for large gatherings, symbolizing community, shared experiences, or the excitement of events.",2
Stalking,"Represents following or observing closely, often symbolizing persistence, focused attention, or the pursuit of goals.",2
Stamp,"Symbolizes validation or proof of payment, representing transactions, travel, or the marking of significant exchanges.",2
Standing,"Indicates the act of being upright or firm, symbolizing resilience, presence, or the ability to stand one's ground.",2
Star,"Represents a celestial body, symbolizing guidance, aspiration, or the pursuit of distant goals and dreams.",0
Starfish,"Symbolizes resilience and regeneration, representing adaptation, the ability to bounce back, or the healing aspects of nature.",2
Stargate,"Represents a portal to other worlds or dimensions, symbolizing exploration, new possibilities, or the journey to the unknown.",0
Starting,"Indicates the beginning of a process or journey, symbolizing new initiatives, fresh starts, or the onset of a new phase.",2
Starting a Business,"Represents entrepreneurship and initiative, symbolizing ambition, innovation, or the challenges of starting new ventures.",2
Startle,"Indicates a sudden shock or surprise, symbolizing unexpected changes, startling revelations, or abrupt awakenings.",0
Startling,"Represents causing surprise or shock, symbolizing unforeseen changes, disruptive events, or dramatic revelations.",2
Station,"Symbolizes a hub or place of activity, representing connectivity, travel, or the convergence of different life paths.",2
Statue of Liberty,"Represents freedom and democracy, symbolizing hope, liberation, or the ideals of freedom and opportunity.",2
Steaming,"Indicates the process of emitting steam, symbolizing release, transformation, or the expression of pent-up emotions.",0
Steampunk World,"Symbolizes a fusion of the past and future, representing creativity, alternative realities, or imaginative explorations.",0
Stirring,"Represents the act of mixing or agitating, symbolizing involvement, stirring up ideas, or the process of change.",2
Stonehenge,"Symbolizes ancient mysteries and timelessness, representing the unknown, historical significance, or spiritual connections.",0
Stool,"Indicates support or a place to rest, symbolizing stability, practicality, or taking a break from life's activities.",2
Stopping,"Represents halting or pausing time, symbolizing control, suspension of activities, or the desire to freeze moments.",2
Stopwatch,"Symbolizes precise timing or measurement, representing accuracy, time management, or the importance of timing.",2
Store,"Represents commerce and exchange, symbolizing transactions, shopping, or the abundance of choices.",2
Storm,"Symbolizes turbulent emotions or events, representing upheaval, intense challenges, or the cleansing nature of conflict.",2
Storming,"Indicates aggressive or intense action, symbolizing confrontation, unleashing emotions, or dramatic changes.",2
Storytelling,"Represents the art of conveying narratives, symbolizing creativity, communication, or the sharing of experiences.",2
Street Art,"Symbolizes public expression through art, representing creativity, community voices, or urban artistic expression.",2
Stretching,"Indicates extending or expanding, symbolizing flexibility, growth, or the need for physical or mental stretching.",2
Stubborning,"Represents persistent refusal to change, symbolizing determination, resistance, or the challenge of inflexibility.",2
Stubbornness,"Symbolizes unyielding attitudes or positions, representing firmness, persistence, or the struggle against change.",2
